{
    "$schema": "http://json-schema.org/draft-07/schema#",
    "$id": "user.schema.json",
    "title": "User Seed Schema",
    "description": "JSON schema for User entity seeds",
    "type": "object",
    "properties": {
        "$schema": {
            "type": "string"
        },
        "id": {
            "type": "string",
            "description": "User ID (UUID)"
        },
        "slug": {
            "type": "string",
            "description": "User slug"
        },
        "displayName": {
            "type": "string",
            "description": "User display name"
        },
        "firstName": {
            "type": "string",
            "description": "User first name"
        },
        "lastName": {
            "type": "string",
            "description": "User last name"
        },
        "birthDate": {
            "type": "string",
            "format": "date",
            "description": "User birth date"
        },
        "contactInfo": {
            "$ref": "common.schema.json#/definitions/contactInfo"
        },
        "location": {
            "$ref": "common.schema.json#/definitions/location"
        },
        "socialNetworks": {
            "$ref": "common.schema.json#/definitions/socialNetworks"
        },
        "role": {
            "type": "string",
            "enum": ["SUPER_ADMIN", "ADMIN", "EDITOR", "HOST", "USER", "GUEST"],
            "description": "User role"
        },
        "permissions": {
            "oneOf": [
                {
                    "type": "array",
                    "items": {
                        "type": "string",
                        "enum": [
                            "accommodation.create",
                            "accommodation.update.own",
                            "accommodation.update.any",
                            "accommodation.delete.own",
                            "accommodation.delete.any",
                            "accommodation.restore.own",
                            "accommodation.restore.any",
                            "destination.create",
                            "destination.update.own",
                            "destination.update.any",
                            "destination.delete.own",
                            "destination.delete.any",
                            "destination.restore.own",
                            "destination.restore.any",
                            "event.create",
                            "event.update.own",
                            "event.update.any",
                            "event.delete.own",
                            "event.delete.any",
                            "event.restore.own",
                            "event.restore.any",
                            "post.create",
                            "post.update.own",
                            "post.update.any",
                            "post.delete.own",
                            "post.delete.any",
                            "post.restore.own",
                            "post.restore.any",
                            "user.create",
                            "user.update.own",
                            "user.update.any",
                            "user.delete.own",
                            "user.delete.any",
                            "user.restore.own",
                            "user.restore.any"
                        ]
                    },
                    "description": "Array of user permissions"
                },
                {
                    "type": "object",
                    "properties": {
                        "canManageOwnAccommodations": {
                            "type": "boolean",
                            "description": "Can manage own accommodations"
                        },
                        "canViewReservations": {
                            "type": "boolean",
                            "description": "Can view reservations"
                        },
                        "canRespondToReviews": {
                            "type": "boolean",
                            "description": "Can respond to reviews"
                        },
                        "canCreatePosts": {
                            "type": "boolean",
                            "description": "Can create posts"
                        },
                        "canViewAnalytics": {
                            "type": "boolean",
                            "description": "Can view analytics"
                        }
                    },
                    "additionalProperties": false,
                    "description": "Object with permission flags"
                }
            ]
        },
        "profile": {
            "type": "object",
            "properties": {
                "firstName": {
                    "type": "string",
                    "description": "User first name"
                },
                "lastName": {
                    "type": "string",
                    "description": "User last name"
                },
                "displayName": {
                    "type": "string",
                    "description": "User display name"
                },
                "avatar": {
                    "type": "string",
                    "description": "Avatar URL"
                },
                "bio": {
                    "type": "string",
                    "description": "User biography"
                },
                "website": {
                    "type": "string",
                    "description": "User website URL"
                },
                "occupation": {
                    "type": "string",
                    "description": "User occupation"
                },
                "location": {
                    "$ref": "common.schema.json#/definitions/location"
                },
                "contactInfo": {
                    "$ref": "common.schema.json#/definitions/contactInfo"
                }
            },
            "additionalProperties": false
        },
        "settings": {
            "type": "object",
            "properties": {
                "theme": {
                    "type": "string",
                    "enum": ["AUTO", "LIGHT", "DARK"],
                    "description": "Theme preference"
                },
                "darkMode": {
                    "type": "boolean",
                    "description": "Dark mode preference"
                },
                "language": {
                    "type": "string",
                    "description": "Preferred language"
                },
                "timezone": {
                    "type": "string",
                    "description": "User timezone"
                },
                "notifications": {
                    "type": "object",
                    "properties": {
                        "enabled": {
                            "type": "boolean",
                            "description": "Notifications enabled"
                        },
                        "allowEmails": {
                            "type": "boolean",
                            "description": "Email notifications enabled"
                        },
                        "allowSms": {
                            "type": "boolean",
                            "description": "SMS notifications enabled"
                        },
                        "allowPush": {
                            "type": "boolean",
                            "description": "Push notifications enabled"
                        },
                        "email": {
                            "type": "boolean",
                            "description": "Email notifications enabled"
                        },
                        "push": {
                            "type": "boolean",
                            "description": "Push notifications enabled"
                        },
                        "sms": {
                            "type": "boolean",
                            "description": "SMS notifications enabled"
                        }
                    },
                    "additionalProperties": false
                },
                "privacy": {
                    "type": "object",
                    "properties": {
                        "profileVisibility": {
                            "type": "string",
                            "enum": ["PUBLIC", "PRIVATE", "FRIENDS_ONLY"],
                            "description": "Profile visibility level"
                        },
                        "showEmail": {
                            "type": "boolean",
                            "description": "Show email in profile"
                        },
                        "showPhone": {
                            "type": "boolean",
                            "description": "Show phone in profile"
                        }
                    },
                    "additionalProperties": false
                }
            },
            "additionalProperties": false
        },
        "bookmarks": {
            "type": "array",
            "items": {
                "type": "object",
                "properties": {
                    "id": {
                        "type": "string",
                        "description": "Bookmark ID"
                    },
                    "entityId": {
                        "type": "string",
                        "description": "Entity ID being bookmarked"
                    },
                    "entityType": {
                        "type": "string",
                        "enum": ["ACCOMMODATION", "DESTINATION", "USER", "POST", "EVENT"],
                        "description": "Type of entity being bookmarked"
                    },
                    "name": {
                        "type": "string",
                        "description": "Bookmark name"
                    },
                    "description": {
                        "type": "string",
                        "description": "Bookmark description"
                    }
                },
                "required": ["id", "entityId", "entityType"],
                "additionalProperties": false
            },
            "description": "User bookmarks"
        },
        "lifecycleState": {
            "type": "string",
            "enum": ["ACTIVE", "INACTIVE", "DRAFT", "ARCHIVED"],
            "description": "Lifecycle state of the user"
        },
        "visibility": {
            "type": "string",
            "enum": ["PUBLIC", "DRAFT", "PRIVATE"],
            "description": "Visibility level of the user"
        }
    },
    "required": ["id", "slug", "role", "permissions"],
    "additionalProperties": false
}
