{
    "$schema": "../../schemas/user.schema.json",
    "id": "005-user-miguel-torres",
    "slug": "miguel-torres",
    "role": "HOST",
    "permissions": [
        "accommodation.create",
        "accommodation.update.own",
        "accommodation.delete.own",
        "event.create",
        "event.update.own",
        "event.delete.own"
    ],
    "firstName": "Miguel",
    "lastName": "Torres",
    "displayName": "Miguel Torres",
    "contactInfo": {
        "website": "https://cabanasmiguel.com"
    },
    "location": {
        "state": "Entre Ríos",
        "city": "Victoria",
        "country": "Argentina",
        "zipCode": "3153",
        "street": "Ruta Provincial 11",
        "number": "km 15",
        "coordinates": {
            "lat": "-32.6167",
            "lng": "-60.1500"
        }
    },
    "socialNetworks": {
        "facebook": "https://facebook.com/cabanas.miguel",
        "instagram": "https://instagram.com/cabanas_miguel",
        "whatsapp": "+54 11 5555-0006",
        "youtube": "https://youtube.com/c/cabanasmiguel"
    },
    "profile": {
        "avatar": "https://images.unsplash.com/photo-1472099645785-5658abf4ff4e?w=150&h=150&fit=crop&crop=face",
        "bio": "Propietario de cabañas y casas de campo en Victoria. Especializado en turismo familiar y actividades al aire libre. Ofrece experiencias personalizadas para cada huésped.",
        "website": "https://cabanasmiguel.com"
    },
    "settings": {
        "language": "es",
        "notifications": {
            "enabled": true,
            "allowEmails": true,
            "allowSms": false,
            "allowPush": true
        }
    },
    "lifecycleState": "ACTIVE",
    "visibility": "PUBLIC"
}
