{
    "$schema": "../../schemas/user.schema.json",
    "id": "007-user-super-administrator",
    "slug": "super-administrator",
    "role": "SUPER_ADMIN",
    "permissions": [
        "accommodation.create",
        "accommodation.update.any",
        "accommodation.delete.any",
        "accommodation.restore.any",
        "destination.create",
        "destination.update.any",
        "destination.delete.any",
        "destination.restore.any",
        "event.create",
        "event.update.any",
        "event.delete.any",
        "event.restore.any",
        "post.create",
        "post.update.any",
        "post.delete.any",
        "post.restore.any",
        "user.create",
        "user.update.any",
        "user.delete.any",
        "user.restore.any"
    ],
    "firstName": "Super",
    "lastName": "Administrator",
    "displayName": "Super Administrator",
    "contactInfo": {
        "personalEmail": "superadmin@hospeda.com",
        "workEmail": "admin@hospeda.com",
        "mobilePhone": "+54 11 5555-0001",
        "preferredEmail": "WORK",
        "preferredPhone": "MOBILE"
    },
    "location": {
        "state": "Entre Ríos",
        "city": "Paraná",
        "country": "Argentina",
        "zipCode": "3100",
        "coordinates": {
            "lat": "-31.7333",
            "lng": "-60.5333"
        }
    },
    "socialNetworks": {
        "linkedin": "https://linkedin.com/in/superadmin-hospeda"
    },
    "profile": {
        "avatar": "https://images.unsplash.com/photo-1472099645785-5658abf4ff4e?w=150&h=150&fit=crop&crop=face",
        "bio": "Super administrador del sistema con acceso completo a todas las funcionalidades. Responsable de la gestión general de la plataforma y configuraciones del sistema."
    },
    "settings": {
        "language": "es",
        "notifications": {
            "enabled": true,
            "allowEmails": true,
            "allowSms": false,
            "allowPush": true
        }
    },
    "lifecycleState": "ACTIVE",
    "visibility": "PUBLIC"
}
